{"schema_version":"cio-decision-draft/2.0.0","run_id":"smoke-01534-conflict-01","invocation_id":"inv_2afc2cf5a29b00ebf692f5b5","status":"INSUFFICIENT_EVIDENCE","agent":"runtime_cio","consumed_reports":[{"agent":"runtime_company_analyst","output_hash":"26989074519bc272bfb574c7facb6d4a688063a0a78086b10188409bd8f4c8ed"},{"agent":"runtime_skeptic","output_hash":"e4c5335656d25b985d44c4a12cbe033c6ea26f12c893e3f888df24a2fa3cca87"}],"action":"NO_TRADE","security_id":"SEC-AAA","current_weight":0.5,"target_weight_range":null,"maximum_notional":null,"time_horizon":"Reassess only when the stated evidence gaps are resolved.","thesis":"The allowed evidence establishes a 2025-12-31 operating-margin observation of 18% and a 2026-01-30 close price of USD 100 for SEC-AAA, but it does not support a reliable operating-trend or valuation conclusion.","counter_thesis":"The core TTM revenue measure is materially conflicted between two allowed sources for the same as-of date, and the evidence set lacks a reconciled income-statement bridge, capital-structure, cash-flow, and valuation context.","consensus":["Both validated reports identify the unresolved same-date TTM revenue conflict as material to any conclusion relying on revenue.","Both reports conclude that the permitted evidence is insufficient for a reliable valuation or broader fundamental assessment.","The operating-margin and price observations are traceable facts but lack sufficient contextual support for an action."],"conflicts":[{"conflict_key":"sec-aaa|revenue_ttm|2025-12-31T00:00:00+00:00","evidence_refs":["ev-conflict-revenue-a","ev-conflict-revenue-b"],"summary":"Allowed sources report incompatible TTM revenue values of USD 1,000,000 and USD 1,250,000 for the same security, semantic field, and as-of date; the evidence set provides no reconciliation or source-authority basis.","unresolved":true,"decision_impact":"A revenue-dependent operating-trend, margin-context, or valuation interpretation cannot be used to support a portfolio action.","confidence_impact":"The unresolved 25% difference materially limits confidence despite traceable price and margin observations."}],"unresolved_questions":["Which revenue source reflects the authoritative reporting entity, accounting scope, period definition, and restatement status?","Can operating income and revenue be reconciled on a consistent basis to interpret the reported operating margin?","What point-in-time share count, net debt, cash-flow, and historical or peer context establish valuation and downside resilience?"],"invalidation_conditions":["A source-authoritative reconciliation identifies and explains the correct TTM revenue measure with matching entity scope and period.","A consistent income-statement bridge verifies the operating-margin calculation against reconciled revenue.","Additional point-in-time financial-capacity and valuation evidence materially changes the evidence insufficiency."],"confidence":0.22,"confidence_rationale":"Confidence is high that the conflict and key data gaps are real because both validated reports independently identify them and the mechanical conflict record confirms incompatible allowed observations. Confidence in any action is low because the conflict remains unresolved and valuation-relevant evidence is absent.","evidence_refs":["ev-conflict-margin","ev-conflict-price","ev-conflict-revenue-a","ev-conflict-revenue-b"],"no_trade_reason":"UNRESOLVED_EVIDENCE_CONFLICT_AND_INSUFFICIENT_VALUATION_CONTEXT","no_trade_explanation":"No portfolio action is supported while same-date TTM revenue remains unresolved and the permitted evidence lacks the reconciled financial and valuation context needed to assess the existing position. This is advisory only.","reevaluation_conditions":["Obtain an authorized reconciliation of the two revenue observations.","Obtain authorized, point-in-time operating-income, revenue, cash-flow, capital-structure, and valuation-context evidence."],"skill_execution":[{"skill_name":"portfolio-council","version":"2.0.0","invocation_hash":"acf8c7a2c440f93cbce1ce973f589833d403c8557ea2659a90a1cf717c6d45c9"}],"advisory_only":true}
